{
  "status": "SUCCESS",
  "summary": "在 OrderService.create 中新增 validate 方法，校验 orders.amount 非空、为有效数字且大于 0，修复金额为空时导致 500 错误的问题。共修改 1 个文件，新增 7 行代码，7 个测试用例全部通过。",
  "changedFiles": [
    "src/services/OrderService.js"
  ],
  "testCommands": [
    "npm test"
  ],
  "testStatus": "PASSED",
  "riskLevel": "LOW",
  "prBody": "## 问题\nPOST /api/orders 接口在 `orders.amount` 为 null 时，`OrderService.create` 未做校验直接写入数据库，导致 500 错误。\n\n## 根因\n`OrderService.create` 方法在调用 `repository.save` 之前缺少对 `orders.amount` 字段的校验。\n\n## 修复方案\n在 `OrderService` 中新增 `validate` 方法，校验 `orders.amount` 必须为非空、有效数字且大于 0。`create` 方法在执行 `repository.save` 前调 `validate` 进行校验。\n\n## 修改文件\n- `src/services/OrderService.js`: 新增 `validate` 方法及 `create` 中的校验调用\n\n## 测试\n- 7 个测试用例全部通过（包括合法订单创建、null/undefined/非数字/负数/零金额拒绝、无效订单不持久化）",
  "needHumanAction": false
}
