{
  "status": "SUCCESS",
  "summary": "根因：OrderService.create 在调用 repository.save 之前缺少对 orders.amount 的空值校验，导致 null amount 传入 JPA 持久化层触发 NOT NULL 约束违反，返回 500 错误。修复方案：在 OrderService.create 方法入口增加 amount 非空校验，若为空则抛出 IllegalArgumentException，Controller 新增 @ExceptionHandler 将该异常转为 HTTP 400 Bad Request，避免 500。同步更新单元测试，验证异常类型和消息。",
  "changedFiles": [
    "src/main/java/com/payment/service/OrderService.java",
    "src/main/java/com/payment/controller/OrderController.java",
    "src/test/java/com/payment/service/OrderServiceTest.java"
  ],
  "testCommands": [
    "cd /work/repo && mvn test"
  ],
  "testStatus": "PASSED",
  "riskLevel": "LOW",
  "needHumanAction": false,
  "prBody": "## 问题\nPOST /api/orders 接口在 orders.amount 为空时，OrderService.create 直接将 null 传入 repository.save，触发 JPA NOT NULL 约束违反，返回 HTTP 500 错误。\n\n## 根因\nOrderService.create 缺少对 amount 参数的空值校验，导致无效数据穿透到数据库层。\n\n## 修复\n1. **OrderService.create** — 在调用 repository.save 前增加 amount null 校验，抛出 `IllegalArgumentException(\"orders.amount must not be null\")`\n2. **OrderController** — 新增 `@ExceptionHandler(IllegalArgumentException.class)`，将该异常转换为 HTTP 400 Bad Request\n3. **OrderServiceTest** — 更新测试断言，验证异常类型为 `IllegalArgumentException` 且消息匹配\n\n## 影响范围\n- 仅影响 POST /api/orders 接口的空 amount 参数校验路径\n- 正常的非空 amount 下单流程不受影响\n- 接口兼容：amount 为空时返回 400 而非 500，下游调用方需适配状态码\n\n## 测试\n- `mvn test` 通过，2/2 测试全部成功"
}
